[
  {
    "id": "u01",
    "name": "Conscription",
    "requires_equipped_unit": "militia",
    "kind": "behavior",
    "description": "Every fifth paid Militia deployment grants one additional Militia. Bonus spawns do not increment this counter.",
    "operator": "paid_militia_every",
    "value": 5,
    "max_rank": 1,
    "selection_weight": 1,
    "icon_asset_id": "icon_u01",
    "additional_rules": {
      "counter_basis": "paid_successful_militia_deployment",
      "bonus_count": 1,
      "recursive": false,
      "pending_bonus_cap": 1,
      "counter_reset": "each_battle"
    },
    "validation_status": "LOCKED_B001_NOT_GAMEPLAY_VALIDATED"
  },
  {
    "id": "u02",
    "name": "Scrap Blades",
    "requires_equipped_unit": "militia",
    "kind": "stat",
    "description": "Militia damage +25%, including base damage.",
    "operator": "damage_add_pct",
    "value": 0.25,
    "max_rank": 1,
    "selection_weight": 1,
    "icon_asset_id": "icon_u02",
    "additional_rules": {},
    "validation_status": "LOCKED_B001_NOT_GAMEPLAY_VALIDATED"
  },
  {
    "id": "u03",
    "name": "Thick Coats",
    "requires_equipped_unit": "militia",
    "kind": "stat",
    "description": "Militia maximum HP +25%.",
    "operator": "hp_add_pct",
    "value": 0.25,
    "max_rank": 1,
    "selection_weight": 1,
    "icon_asset_id": "icon_u03",
    "additional_rules": {},
    "validation_status": "LOCKED_B001_NOT_GAMEPLAY_VALIDATED"
  },
  {
    "id": "u04",
    "name": "First Into Battle",
    "requires_equipped_unit": "shieldguard",
    "kind": "behavior",
    "description": "Shieldguard carries a barrier worth 30% of modified maximum HP. Its 8-second lifetime begins on the first positive incoming damage, absorbing that hit. One activation per unit.",
    "operator": "first_damage_barrier_maxhp_pct",
    "value": 0.3,
    "max_rank": 1,
    "selection_weight": 1,
    "icon_asset_id": "icon_u04",
    "additional_rules": {
      "duration_s": 8,
      "hp_basis": "modified_maximum",
      "refresh": "never_for_same_unit",
      "activation": "first_positive_post_mitigation_damage",
      "absorbs_triggering_damage": true,
      "untriggered_expiry": false
    },
    "validation_status": "LOCKED_B001_NOT_GAMEPLAY_VALIDATED"
  },
  {
    "id": "u05",
    "name": "Reinforced Shields",
    "requires_equipped_unit": "shieldguard",
    "kind": "stat",
    "description": "Shieldguard flat damage reduction increases by 2.",
    "operator": "flat_reduction_add",
    "value": 2,
    "max_rank": 1,
    "selection_weight": 1,
    "icon_asset_id": "icon_u05",
    "additional_rules": {},
    "validation_status": "LOCKED_B001_NOT_GAMEPLAY_VALIDATED"
  },
  {
    "id": "u06",
    "name": "Heavy Boots",
    "requires_equipped_unit": "shieldguard",
    "kind": "stat",
    "description": "Shieldguard maximum HP +30%; movement speed -10%.",
    "operator": "hp_add_pct",
    "value": 0.3,
    "max_rank": 1,
    "selection_weight": 1,
    "icon_asset_id": "icon_u06",
    "additional_rules": {
      "movement_add_pct": -0.1
    },
    "validation_status": "LOCKED_B001_NOT_GAMEPLAY_VALIDATED"
  },
  {
    "id": "u07",
    "name": "Piercing Bolts",
    "requires_equipped_unit": "crossbowman",
    "kind": "behavior",
    "description": "A bolt may hit one additional enemy behind the first for 60% of the original bolt damage.",
    "operator": "additional_pierce_targets",
    "value": 1,
    "max_rank": 1,
    "selection_weight": 1,
    "icon_asset_id": "icon_u07",
    "additional_rules": {
      "secondary_damage_factor": 0.6,
      "max_extra_distance_m": 1.5,
      "can_secondary_hit_base": false,
      "recursive": false
    },
    "validation_status": "LOCKED_B001_NOT_GAMEPLAY_VALIDATED"
  },
  {
    "id": "u08",
    "name": "Tighter Windlass",
    "requires_equipped_unit": "crossbowman",
    "kind": "stat",
    "description": "Crossbowman damage +25%.",
    "operator": "damage_add_pct",
    "value": 0.25,
    "max_rank": 1,
    "selection_weight": 1,
    "icon_asset_id": "icon_u08",
    "additional_rules": {},
    "validation_status": "LOCKED_B001_NOT_GAMEPLAY_VALIDATED"
  },
  {
    "id": "u09",
    "name": "Quick Reload",
    "requires_equipped_unit": "crossbowman",
    "kind": "stat",
    "description": "Crossbowman attack rate +20%.",
    "operator": "attack_rate_add_pct",
    "value": 0.2,
    "max_rank": 1,
    "selection_weight": 1,
    "icon_asset_id": "icon_u09",
    "additional_rules": {},
    "validation_status": "LOCKED_B001_NOT_GAMEPLAY_VALIDATED"
  },
  {
    "id": "u10",
    "name": "Packed Powder",
    "requires_equipped_unit": "grenadier",
    "kind": "behavior",
    "description": "Grenadier explosion radius +50%.",
    "operator": "splash_radius_add_pct",
    "value": 0.5,
    "max_rank": 1,
    "selection_weight": 1,
    "icon_asset_id": "icon_u10",
    "additional_rules": {},
    "validation_status": "LOCKED_B001_NOT_GAMEPLAY_VALIDATED"
  },
  {
    "id": "u11",
    "name": "Heavy Charges",
    "requires_equipped_unit": "grenadier",
    "kind": "stat",
    "description": "Grenadier damage +25%.",
    "operator": "damage_add_pct",
    "value": 0.25,
    "max_rank": 1,
    "selection_weight": 1,
    "icon_asset_id": "icon_u11",
    "additional_rules": {},
    "validation_status": "LOCKED_B001_NOT_GAMEPLAY_VALIDATED"
  },
  {
    "id": "u12",
    "name": "Fast Fuses",
    "requires_equipped_unit": "grenadier",
    "kind": "stat",
    "description": "Grenadier attack rate +20%. Projectile travel is unchanged.",
    "operator": "attack_rate_add_pct",
    "value": 0.2,
    "max_rank": 1,
    "selection_weight": 1,
    "icon_asset_id": "icon_u12",
    "additional_rules": {},
    "validation_status": "LOCKED_B001_NOT_GAMEPLAY_VALIDATED"
  },
  {
    "id": "u13",
    "name": "Sweeping Club",
    "requires_equipped_unit": "brute",
    "kind": "behavior",
    "description": "Brute strikes also hit the nearest two additional enemy units within 0.8m of the primary target for 40% damage.",
    "operator": "extra_melee_targets",
    "value": 2,
    "max_rank": 1,
    "selection_weight": 1,
    "icon_asset_id": "icon_u13",
    "additional_rules": {
      "additional_targets": 2,
      "radius_m": 0.8,
      "secondary_damage_factor": 0.4,
      "can_secondary_hit_base": false,
      "recursive": false
    },
    "validation_status": "LOCKED_B001_NOT_GAMEPLAY_VALIDATED"
  },
  {
    "id": "u14",
    "name": "Iron Belly",
    "requires_equipped_unit": "brute",
    "kind": "stat",
    "description": "Brute maximum HP +25%.",
    "operator": "hp_add_pct",
    "value": 0.25,
    "max_rank": 1,
    "selection_weight": 1,
    "icon_asset_id": "icon_u14",
    "additional_rules": {},
    "validation_status": "LOCKED_B001_NOT_GAMEPLAY_VALIDATED"
  },
  {
    "id": "u15",
    "name": "Brutal Force",
    "requires_equipped_unit": "brute",
    "kind": "stat",
    "description": "Brute damage +25%.",
    "operator": "damage_add_pct",
    "value": 0.25,
    "max_rank": 1,
    "selection_weight": 1,
    "icon_asset_id": "icon_u15",
    "additional_rules": {},
    "validation_status": "LOCKED_B001_NOT_GAMEPLAY_VALIDATED"
  },
  {
    "id": "u16",
    "name": "Splintering Head",
    "requires_equipped_unit": "ram",
    "kind": "behavior",
    "description": "Every third landed Ram hit on an enemy base deals an additional 100% of that hit’s direct damage to the base.",
    "operator": "base_hits_per_bonus",
    "value": 3,
    "max_rank": 1,
    "selection_weight": 1,
    "icon_asset_id": "icon_u16",
    "additional_rules": {
      "landed_base_hits_interval": 3,
      "bonus_damage_factor": 1.0,
      "recursive": false,
      "counter_reset": "per_ram_spawn"
    },
    "validation_status": "LOCKED_B001_NOT_GAMEPLAY_VALIDATED"
  },
  {
    "id": "u17",
    "name": "Siege Engineering",
    "requires_equipped_unit": "ram",
    "kind": "stat",
    "description": "Ram base damage +35%; Supply cost +15%.",
    "operator": "base_damage_add_pct",
    "value": 0.35,
    "max_rank": 1,
    "selection_weight": 1,
    "icon_asset_id": "icon_u17",
    "additional_rules": {
      "supply_cost_add_pct": 0.15
    },
    "validation_status": "LOCKED_B001_NOT_GAMEPLAY_VALIDATED"
  },
  {
    "id": "u18",
    "name": "Reinforced Frame",
    "requires_equipped_unit": "ram",
    "kind": "stat",
    "description": "Ram maximum HP +25%.",
    "operator": "hp_add_pct",
    "value": 0.25,
    "max_rank": 1,
    "selection_weight": 1,
    "icon_asset_id": "icon_u18",
    "additional_rules": {},
    "validation_status": "LOCKED_B001_NOT_GAMEPLAY_VALIDATED"
  },
  {
    "id": "u19",
    "name": "War Economy",
    "requires_equipped_unit": null,
    "kind": "stat",
    "description": "Supply regeneration +15%.",
    "operator": "supply_rate_add_pct",
    "value": 0.15,
    "max_rank": 1,
    "selection_weight": 1,
    "icon_asset_id": "icon_u19",
    "additional_rules": {},
    "validation_status": "LOCKED_B001_NOT_GAMEPLAY_VALIDATED"
  },
  {
    "id": "u20",
    "name": "Deep Stores",
    "requires_equipped_unit": null,
    "kind": "stat",
    "description": "Supply capacity +50 and starting Supply +25 each battle.",
    "operator": "supply_cap_add",
    "value": 50,
    "max_rank": 1,
    "selection_weight": 1,
    "icon_asset_id": "icon_u20",
    "additional_rules": {
      "starting_supply_add": 25
    },
    "validation_status": "LOCKED_B001_NOT_GAMEPLAY_VALIDATED"
  },
  {
    "id": "u21",
    "name": "War Drums",
    "requires_equipped_unit": null,
    "kind": "stat",
    "description": "Rally duration +2 seconds.",
    "operator": "rally_duration_add_s",
    "value": 2,
    "max_rank": 1,
    "selection_weight": 1,
    "icon_asset_id": "icon_u21",
    "additional_rules": {},
    "validation_status": "LOCKED_B001_NOT_GAMEPLAY_VALIDATED"
  },
  {
    "id": "u22",
    "name": "Field Training",
    "requires_equipped_unit": null,
    "kind": "stat",
    "description": "All troops gain +10% maximum HP and +10% damage.",
    "operator": "hp_and_damage_add_pct",
    "value": 0.1,